{
  "id": "lv_s454v0q3",
  "rev": 1,
  "revKind": "text",
  "status": "published",
  "chapterId": "ch_65j92w",
  "order": 3,
  "title": { "zh-TW": "ROE 與 ROA 的差距", "en": "The gap between ROE and ROA" },
  "objectiveIds": ["obj_m3fgww"],
  "questionIds": ["q_smc16qav", "q_3t3d57g5", "q_k4k77mya", "q_x74gnk94", "q_a9j40q9m", "q_z363wks6"]
}
