{
  "id": "lv_p4rqx88x",
  "rev": 1,
  "revKind": "text",
  "status": "published",
  "chapterId": "ch_65j92w",
  "order": 2,
  "title": { "zh-TW": "算一算 ROE 的三個因子", "en": "Working out the three factors of ROE" },
  "objectiveIds": ["obj_81e8f8"],
  "questionIds": ["q_xg9hwa7d", "q_bpb8kn9n", "q_qssvjrx3", "q_2acjgfp8", "q_xtjcy3px", "q_0nypdz57"]
}
