{
  "id": "lv_g51z9e9b",
  "rev": 1,
  "revKind": "text",
  "status": "published",
  "chapterId": "ch_jkhbh3",
  "order": 1,
  "title": {
    "zh-TW": "三條水路",
    "en": "Three channels"
  },
  "objectiveIds": [
    "obj_8ypaqg"
  ],
  "questionIds": [
    "q_1btq1e8n",
    "q_md1kqgtm",
    "q_0f0pawgq",
    "q_m907g1d0",
    "q_4jf2d0r2",
    "q_jzhyqaqz"
  ]
}
