{
  "id": "lv_c0hxq2zv",
  "rev": 2,
  "revKind": "answer",
  "status": "published",
  "chapterId": "ch_ft415v",
  "order": 1,
  "title": {
    "zh-TW": "週轉率與天數",
    "en": "Turnover and days"
  },
  "objectiveIds": [
    "obj_6x06z2"
  ],
  "questionIds": [
    "q_4z386trc",
    "q_v6raznc2",
    "q_bp3wbqfg",
    "q_qse9t0ea",
    "q_emg5qeqw",
    "q_03nrdkrk",
    "q_db7ws3p4"
  ]
}
